{
  "protocol": "upa/1",
  "session": "s-1",
  "seq": 1844,
  "game_s": 61.35,
  "wall_utc": "2026-10-26T18:00:00.1Z",
  "type": "observation",
  "clock_mode": "realtime",
  "scene": "Level1",
  "playing": true,
  "paused": false,
  "time_scale": 1.0,
  "frame": 3680,
  "public": {},
  "ui": {},
  "view": null,
  "reader_errors": [
    {
      "reader": "view",
      "error": "no game-view camera"
    }
  ]
}
