{
  "protocol": "upa/1",
  "session": "s-1",
  "seq": 1843,
  "game_s": 61.3,
  "wall_utc": "2026-10-26T18:00:00.05Z",
  "type": "observation",
  "clock_mode": "realtime",
  "scene": "Level1",
  "playing": true,
  "paused": false,
  "time_scale": 1.0,
  "frame": 3678,
  "public": {},
  "ui": {},
  "view": {
    "yaw_deg": -172.32,
    "pitch_deg": 12.5
  },
  "reader_errors": []
}
